{"schema_version":"1","task_id":"local-node-cftc-tff-v2-public-source-readiness-delta-v1","task_sha256":"3eef04ac79610a10216d15ddedbda56167018bc7fcc106dde3e35c07ac844500","status":"COMPLETED","authorization":"RESEARCH_ONLY_NOT_SHADOW_PAPER_OR_LIVE","started_at":"2026-08-10T15:34:00Z","completed_at":"2026-08-10T15:39:02Z","source_git_commit":"0285f101ed4b4ffc29ef8cb8991db4291f62c942","source_git_dirty_before":false,"source_git_dirty_after":false,"summary":"ONE_PUBLIC_SOURCE_CONTRACT_READY_FOR_LATER_REVIEW. The prior matrix's sole named CFTC V2 blocker was the absence of an accepted full headerless positional transport proof. Exact accepted lifecycle and Git-object evidence now supplies a COMPLETED/COUNT CFTC_TFF_HEADERLESS_TRANSPORT_READY proof, while a separate accepted COMPLETED CFTC_TFF_HEADERLESS_OFFLINE_V2_READY package remains disabled and NON_COUNTING/EXCLUDE. Its five exact artifacts bind distinct V2 identity, headerless 87-field parsing, fixed dual-date equality and Tuesday gates, raw/row seals, predecessor chain and strictly-post-receipt eligibility. Together with the already accepted source design, these satisfy the predecessor matrix's point-in-time transport and deterministic-source-semantics condition. Deribit WAIT, OKX liquidation CLOSE and mempool WAIT remain unchanged and were not re-audited. This successor audit is NON_COUNTING/NON_COUNTING_NOT_APPLICABLE. Immediate fee-adjusted PnL and drawdown effects are zero; operations, future continuity, factor validity, prediction and economics remain MISSING_PROOF.","checks":[{"name":"SOURCE_IDENTITY_AND_CLEANLINESS","status":"PASS","evidence":"Branch codex/autonomous-research-control-plane-v3, HEAD and local origin all matched 0285f101ed4b4ffc29ef8cb8991db4291f62c942. Worktree was clean before analysis and remained clean after all read-only checks."},{"name":"TASK_DISPATCH_INTENT_BYTES","status":"PASS","evidence":"Task SHA 3eef04ac79610a10216d15ddedbda56167018bc7fcc106dde3e35c07ac844500, canonical dispatch SHA 4e93a054a70dae01c907f4d0096cd1cc3882ae0a4344787c9fee6c53ecf09d2e and intent SHA 7827a911a29eab33ac0417f3ee572aa9b7512050ab3638363b4b1644b9f47597 matched. Task and dispatch repository validators returned VALID; the dependency-neutral classification validator accepted the canonical PRE_DISPATCH_INTENT and its exact task/dispatch/claim bindings."},{"name":"STOP_AND_INPUT_CLOSURE","status":"PASS","evidence":"All 30 non-null inputs were unique, repository-contained regular non-link non-reparse files with exact SHA-256. Task, dispatch and intent bytes equaled current HEAD objects. The 18 canonical stop conditions hashed to 5c54cf04708f14527d18d51ee15649f50c179e08dabb4a0821e63783bc4398c6."},{"name":"PROSPECTIVE_CLASSIFICATION","status":"PASS","evidence":"The canonical intent freezes NON_COUNTING / NON_COUNTING_NOT_APPLICABLE for duplicate family cftc-cme-bitcoin-tff-headerless-transport, max_candidate_variants=0, and maps all three possible dispositions to EXCLUDE. It cannot create another weekly output or alpha family."},{"name":"PRIOR_MATRIX_CLOSURE","status":"PASS","evidence":"The prior matrix task/dispatch/result returned VALIDATED_RESULT_BOUND_TO_PERFORMANCE_DISPATCH. Its accepted predecessor result was COMPLETED with NO_PUBLIC_FACTOR_SOURCE_EVIDENCE_READY_WAIT and named only WAIT_FOR_ACCEPTED_HEADERLESS_TRANSPORT_PROOF as the CFTC V2 blocker."},{"name":"ACCEPTED_SOURCE_DESIGN","status":"PASS","evidence":"The prior matrix's sealed closure accepted the listed CFTC source-design result. That result is COMPLETED/CFTC_CME_BITCOIN_TFF_SOURCE_DESIGN_READY and freezes exact identity 133741, release clock, sealing, absence/drift and strictly-post-receipt causal boundaries without selecting a factor."},{"name":"HEADERLESS_TRANSPORT_LIFECYCLE","status":"PASS","evidence":"Exact transport task/dispatch/result closure is VALIDATED_RESULT_BOUND_TO_PERFORMANCE_DISPATCH. Canonical intent and Manager acceptance passed Git-object, ancestry, timestamp, task/dispatch/result and claim-boundary validation. Accepted disposition is CFTC_TFF_HEADERLESS_TRANSPORT_READY, status COMPLETED, classification COUNT and UNIQUE_FAMILY."},{"name":"DISABLED_V2_PACKAGE_LIFECYCLE","status":"PASS","evidence":"Exact V2 implementation task/dispatch/result closure is VALIDATED_RESULT_BOUND_TO_PERFORMANCE_DISPATCH. Canonical intent and Manager acceptance passed Git-object, ancestry, timestamp and hash binding. Accepted disposition is CFTC_TFF_HEADERLESS_OFFLINE_V2_READY, status COMPLETED, classification EXCLUDE under NON_COUNTING_NOT_APPLICABLE."},{"name":"V2_ARTIFACT_HASH_CLOSURE","status":"PASS","evidence":"All five V2 artifact hashes matched the accepted result and current repository bytes: contract 726d7ebf..., contract schema f8daf4c6..., observation schema 44d46dc8..., module 69127fa3..., tests ef242594.... No artifact or V1 byte was changed."},{"name":"V2_DETERMINISTIC_GATES","status":"PASS","evidence":"Listed bytes confirm OFFLINE_DISABLED_NOT_REGISTERED, distinct V2 identity, exact 87-field headerless positional policy, fixed %y%m%d and %Y-%m-%d lossless same-Tuesday parsing, exact 133741 target, raw/selected-row seals, predecessor chain, same-date drift block and strictly-post-receipt decision guard. Network, database, registration and capture remain denied."},{"name":"NAMED_BLOCKER_RECONCILIATION","status":"PASS","evidence":"The precise predecessor blocker is resolved: an accepted current-response headerless transport proof now exists and the accepted disabled deterministic V2 package implements the frozen transport semantics. No additional source-contract proof named by the predecessor matrix remains missing."},{"name":"OTHER_FAMILY_BOUNDARY","status":"PASS","evidence":"No Deribit, OKX liquidation or mempool source bytes beyond the sealed predecessor matrix were re-audited. Their prior dispositions remain respectively WAIT_FOR_NAMED_POINT_IN_TIME_PROOF, CLOSE_SOURCE_INSUFFICIENT and WAIT_FOR_NAMED_POINT_IN_TIME_PROOF."},{"name":"READINESS_DELTA_DISPOSITION","status":"PASS","evidence":"ONE_PUBLIC_SOURCE_CONTRACT_READY_FOR_LATER_REVIEW is selected because accepted source design, accepted live headerless transport proof and accepted deterministic disabled V2 package jointly satisfy the exact prior readiness condition. This is source-contract readiness only."},{"name":"OPERATIONAL_PREDICTIVE_BOUNDARY","status":"MISSING_PROOF","evidence":"Future CFTC availability/layout continuity, source registration, live capture, intake, deployment, factor field/formula/transform/sign/threshold/horizon, predictive value, candidate readiness and OOS authority were neither accessed nor proven."},{"name":"PERFORMANCE_DRAWDOWN_OPPORTUNITY_COST","status":"PASS","evidence":"Immediate fee-adjusted total PnL delta and immediate drawdown effect are exactly zero. Matched-capital PnL, drawdown, stability, utilization, turnover, capacity, holding age and opportunity-cost reduction remain MISSING_PROOF. The bounded benefit is avoiding another four-family audit or parser loop while capping the next spend at one factor-semantic readiness review."},{"name":"LOCAL_DRAFT_EXECUTABLE_VALIDATION","status":"MISSING_PROOF","evidence":"The repository's dependency-neutral task, dispatch, result and classification validators passed, but the bundled Local runtime lacks jsonschema and the provisioned system Python executable was inaccessible in this sandbox. No dependency was installed and no permission was requested."},{"name":"ZERO_WRITE_AND_SAFETY_BOUNDARY","status":"PASS","evidence":"No file, Git object, repository state, .research-state, canonical state, server, MCP, heartbeat, schedule, source, candidate, OOS or Trading state was changed. artifacts and files_changed are empty; all safety assertions remain false."}],"artifacts":[],"files_changed":[],"uncertainty":["MISSING_PROOF: one accepted current response does not establish future CFTC availability, layout continuity, publication continuity or transport durability.","MISSING_PROOF: operational producer, registration, live capture, intake, deployment and canonical integration remain unauthorized and unproven.","MISSING_PROOF: no COT field, formula, transform, sign, threshold, horizon, predictive value, matched-capital economics, candidate readiness or OOS authority has been selected or proven.","MISSING_PROOF: local Draft 2020-12 executable validation was unavailable; dependency-neutral repository validators and exact canonical/hash checks passed without installing dependencies.","The other three public-source family dispositions are preserved from the sealed predecessor matrix and were not independently re-audited in this delta task."],"recommended_next_action":"Manager may freeze exactly one bounded READ_ONLY factor-semantic readiness review for this accepted CFTC V2 source contract, with zero outcome access and zero candidate variants. It must not select or implement a COT field, formula, transform, sign, threshold, horizon, strategy, capture, registration, deployment or Trading action.","safety_assertions":{"canonical_state_changed":false,"server_research_mcp_write_attempted":false,"second_timer_created":false,"trading_action_attempted":false,"oos_opened":false,"paid_api_used":false}}
