{"schema_version":"1","task_id":"local-node-current-python-runtime-readiness-v1","task_sha256":"465081d9c645003aafa1745218aef1e86d4ef9dffa93fb819781824dd01bf8c8","status":"BLOCKED","authorization":"RESEARCH_ONLY_NOT_SHADOW_PAPER_OR_LIVE","started_at":"2026-08-14T11:49:30Z","completed_at":"2026-08-14T11:51:26Z","source_git_commit":"20896f21bd77192c11a30943854f400530b4be09","source_git_dirty_before":false,"source_git_dirty_after":false,"summary":"LOCAL_PYTHON_RUNTIME_UNAVAILABLE. Exact source, task, dispatch, intent and all fourteen repository-input byte bindings passed native read-only closure. No python command was available on PATH. The existing executable C:\\Users\\Redan\\AppData\\Local\\Programs\\Python\\Python312\\python.exe was present but process creation was denied by the Local sandbox, so its exact runtime version, repository import, CLI help surfaces and executable validators could not be proven. The V3R1 active-chain verifier consequently failed under both Windows PowerShell 5.1 and PowerShell 7 with the same PYTHON_COMMAND_UNAVAILABLE reason and produced no VALID JSON for byte-equivalence comparison. No installation, repair, permission request or gate bypass was attempted. Immediate fee-adjusted PnL and drawdown effects are zero; all scientific, evidence, economic, candidate, OOS and activation value remains MISSING_PROOF.","checks":[{"name":"SOURCE_BRANCH_HEAD_ORIGIN_CLEAN","status":"PASS","evidence":"Branch codex/autonomous-research-control-plane-v3 was clean before and after the audit. HEAD and local origin both equaled 20896f21bd77192c11a30943854f400530b4be09."},{"name":"TASK_DISPATCH_INTENT_HASHES","status":"PASS","evidence":"Task SHA-256 matched 465081d9c645003aafa1745218aef1e86d4ef9dffa93fb819781824dd01bf8c8. Dispatch SHA-256 matched 9c6ac478b25dbfd629c42b25b6ce1a0a67d145204f0a35c89b882bb7f5e7ab99. Intent SHA-256 matched 58bcc68d508c354521de9680b19695e47fba73e2c0eefa021a27fd1cc348d6d8."},{"name":"MANAGER_VALIDATION_RECEIPT","status":"PASS","evidence":"The frozen Manager receipt records task and dispatch VALID under NON_COUNTING_ACTIVE_INTEGRITY_EXCEPTION, 16 total inputs, 14 repository inputs, 10 stop conditions and canonical stop-condition SHA-256 2cdc53f0d5432ca87a1ad3cae1c4a1e993f3c700e17d3f88d3cd76fa0b8d7a71. This is Manager evidence, not claimed as Local executable validation."},{"name":"REPOSITORY_INPUT_CLOSURE","status":"PASS","evidence":"All fourteen non-null repository inputs were unique, contained regular non-link/non-reparse files. Every SHA-256 matched the frozen task and every worktree blob matched its HEAD Git object."},{"name":"PYTHON_COMMAND_DISCOVERY","status":"FAIL","evidence":"Get-Command python returned no executable on PATH."},{"name":"EXPLICIT_PYTHON_EXECUTABLE_START","status":"FAIL","evidence":"C:\\Users\\Redan\\AppData\\Local\\Programs\\Python\\Python312\\python.exe existed as a file. Launch with PYTHONDONTWRITEBYTECODE=1 and -B failed before Python startup with operating-system access denied."},{"name":"PYTHON_VERSION_AND_PATH_PROOF","status":"MISSING_PROOF","evidence":"Selected executable path was C:\\Users\\Redan\\AppData\\Local\\Programs\\Python\\Python312\\python.exe. Exact sys.executable and sys.version output is unavailable because process creation was denied; the directory name was not treated as executable version proof."},{"name":"RESEARCH_PIPELINE_IMPORT_PROOF","status":"MISSING_PROOF","evidence":"import research_pipeline could not execute because Python did not start. No bytecode or ignored output was created."},{"name":"CLI_HELP_SURFACES","status":"MISSING_PROOF","evidence":"validate-local-research-task, local-research-manager-preflight and local-research-throughput-kpi help surfaces could not be executed without Python."},{"name":"LOCAL_TASK_VALIDATOR","status":"MISSING_PROOF","evidence":"The Local authoritative task validator did not execute because Python startup was denied. Exact task bytes and Manager VALID receipt were preserved without substitution."},{"name":"LOCAL_DISPATCH_VALIDATOR","status":"MISSING_PROOF","evidence":"The Local dispatch/task validator did not execute because Python startup was denied. Exact dispatch and task hashes remained unchanged."},{"name":"LOCAL_CLASSIFICATION_INTENT_VALIDATOR","status":"MISSING_PROOF","evidence":"The dependency-neutral classification-intent validator did not execute because Python startup was denied. Exact intent bytes remained unchanged."},{"name":"WINDOWS_POWERSHELL_51_ACTIVE_CHAIN","status":"FAIL","evidence":"Windows PowerShell 5.1 was installed. scripts/verify_local_research_active_chain.ps1 exited 1 at its Python command lookup with fixed reason PYTHON_COMMAND_UNAVAILABLE and did not execute exporter, transfer, receiver, diagnostic or interpretation."},{"name":"POWERSHELL_7_ACTIVE_CHAIN","status":"FAIL","evidence":"PowerShell 7 was installed. scripts/verify_local_research_active_chain.ps1 exited 1 at its Python command lookup with fixed reason PYTHON_COMMAND_UNAVAILABLE and did not execute exporter, transfer, receiver, diagnostic or interpretation."},{"name":"DUAL_SHELL_VALID_JSON_EQUIVALENCE","status":"MISSING_PROOF","evidence":"Both shells failed for the same missing Python command, but neither produced status VALID or classification V3R1_ACTIVE_TERMINAL_EXECUTION_CHAIN_ONLY JSON. Required byte-equivalent VALID output is therefore unproven."},{"name":"ZERO_WRITE_AND_SCOPE_PROOF","status":"PASS","evidence":"No repository, ignored-output, .research-state, canonical, server, schedule, queue, OOS or Trading write occurred. No file was created, edited, staged, committed, pushed or installed; artifacts and files_changed are empty."},{"name":"PERFORMANCE_DRAWDOWN_AND_VALUE_BOUNDARY","status":"MISSING_PROOF","evidence":"Immediate fee-adjusted PnL effect is zero and immediate drawdown effect is zero. Runtime readiness, prediction, causality, evidence quality, matched-capital economics, candidate readiness, OOS, deployment and activation remain MISSING_PROOF."}],"artifacts":[],"files_changed":[],"uncertainty":["The exact Python runtime version remains MISSING_PROOF because the executable could not start.","Repository import and the three required CLI help surfaces remain MISSING_PROOF.","Local task, dispatch and classification-intent executable validation remains MISSING_PROOF despite exact byte closure and the Manager VALID receipt.","V3R1 active-chain status and byte-equivalent PowerShell 5.1/7 VALID output remain MISSING_PROOF.","No market evidence, prediction, causal alpha, fees, slippage, matched-capital PnL, drawdown improvement, candidate readiness, OOS, deployment or Trading value was evaluated."],"recommended_next_action":"Manager should preserve the current evidence-wait state and dispatch no Python-dependent Local evidence task from this runtime. A future bounded runtime-readiness probe may be issued only after the execution environment exposes an already-installed Python executable without installation, repair, permission expansion or PATH mutation; it must repeat this exact zero-write version/import/help/validator and dual-PowerShell gate before any evidence-ready task proceeds.","safety_assertions":{"canonical_state_changed":false,"server_research_mcp_write_attempted":false,"second_timer_created":false,"trading_action_attempted":false,"oos_opened":false,"paid_api_used":false}}
