{"schema_version":"1","task_id":"local-node-cftc-cme-bitcoin-cot-forward-source-design-v1","task_sha256":"a6650b180f7838ed77ada18ae9f62dc583d0f8b9b3ad400f36f5b264c88dccd4","status":"COMPLETED","authorization":"RESEARCH_ONLY_NOT_SHADOW_PAPER_OR_LIVE","started_at":"2026-08-10T08:15:15Z","completed_at":"2026-08-10T08:18:01Z","source_git_commit":"11e65012024d74480a3ce6c75697b2ace2ca889d","source_git_dirty_before":false,"source_git_dirty_after":false,"summary":"CFTC_CME_BITCOIN_TFF_SOURCE_DESIGN_READY. Freeze only CFTC_CME_BITCOIN_TFF_FUTURES_ONLY_V1: Traders in Financial Futures, Futures Only; market BITCOIN - CHICAGO MERCANTILE EXCHANGE; contract market code 133741; fixed future locator https://www.cftc.gov/dea/newcot/FinFutWk.txt. The locator was not opened. A future zero-parameter producer must seal the complete raw response before parsing, require the official ordered 87-field shape, select exactly one identity-matching row, preserve raw suppression markers, and bind report date, contract/market/commodity codes, contract units and FutOnly marker. Tuesday close is observation time; availability is no earlier than the official Friday 3:30 p.m. America/New_York release or the versioned holiday-adjusted schedule. Only the existing daily 09:05 Asia/Taipei Cloud Ops cycle may check. Evidence becomes eligible only for the first existing DRA decision strictly after network-denied canonical intake accepts the sealed receipt, never the same decision/fill cycle. The immutable state machine is NO_NEW_REPORT, CONTRACT_ABSENT, DUPLICATE_CONTRACT_ROW, MALFORMED_REPORT, WRONG_REPORT_FAMILY, REPORT_DATE_IN_FUTURE, RELEASE_NOT_DUE, SOURCE_UNAVAILABLE, SAME_REPORT_BYTES_DRIFT and NEW_REPORT_SEALED. Same-date changed bytes are an integrity alert and cannot overwrite prior evidence. One-way hash-bound transport preserves Server Canonical as sole state writer. Government information may be reused with CFTC acknowledgement; privately supplied material and the CFTC seal are excluded. Immediate fee-adjusted PnL and drawdown effect are exactly zero; all predictive and economic value remains MISSING_PROOF.","checks":[{"name":"TASK_DISPATCH_AND_SOURCE_PREFLIGHT","status":"PASS","evidence":"Exact task SHA, dispatch SHA d130c105602c10d7a6fa83d36b6d2f7ca2476c73d654c1156b47bc324764d37d, 16-stop canonical hash, 12 unique repository-input hashes, branch, clean HEAD and origin all matched. Final worktree remained clean."},{"name":"EXACT_SOURCE_IDENTITY","status":"PASS","evidence":"Design permits only CFTC_CME_BITCOIN_TFF_FUTURES_ONLY_V1, exact CME Bitcoin market/code 133741 and the fixed FinFutWk.txt locator identity. No report, PRE/API dataset, archive or value-bearing endpoint was opened."},{"name":"OFFICIAL_87_FIELD_COMPLETENESS","status":"PASS","evidence":"The [official TFF field dictionary](https://www.cftc.gov/MarketReports/CommitmentsofTraders/HistoricalViewable/cotvariablestfm.html) enumerates exactly 87 ordered fields, ending with FutOnly_or_Combined. Future validation must reject any wrong count, zero/duplicate match or identity drift."},{"name":"TFF_CLASSIFICATION_BOUNDARY","status":"PASS","evidence":"The [official explanatory notes](https://www.cftc.gov/idc/groups/public/%40commitmentsoftraders/documents/file/tfmexplanatorynotes.pdf) define TFF, its four categories, Tuesday open-interest boundary, 20-trader publication condition and distinct futures-only versus combined formats. No field or factor interpretation was selected."},{"name":"RELEASE_AND_TIMEZONE_CLOCK","status":"PASS","evidence":"The [official release schedule](https://www.cftc.gov/MarketReports/CommitmentsofTraders/ReleaseSchedule/index.htm) specifies 3:30 p.m. Eastern, usually Friday for prior-Tuesday data, with federal-holiday delays. Conversion must use America/New_York and Asia/Taipei timezone rules; an immutable versioned schedule is required and out-of-coverage checks fail closed."},{"name":"SINGLE_CLOCK_AND_ELIGIBILITY","status":"PASS","evidence":"Only the existing 09:05 Asia/Taipei Cloud Ops cycle is retained. Capture is the first such cycle after the official release boundary; eligibility is the first pre-existing DRA decision strictly after sealed canonical receipt, preventing observation-date and same-cycle leakage."},{"name":"RAW_ROW_AND_CHAIN_SEAL","status":"PASS","evidence":"The future envelope must bind raw response byte length/SHA-256, received_at, locator identity, exact selected raw-row bytes/hash, canonical 87-field row hash, report identity/date, versioned release proof and predecessor hash. Parsing occurs only after raw-byte sealing."},{"name":"ABSENCE_CORRECTION_AND_DRIFT","status":"PASS","evidence":"The [CFTC methodology](https://www.cftc.gov/MarketReports/CommitmentsofTraders/index.htm) explains contract absence below 20 reportable traders, suppressed trader counts and that published historical data is not updated. The frozen ten-state machine preserves missing observations and blocks overwrite or alternate-source fallback."},{"name":"CHANGE_CONTROL_WITHOUT_BACKFILL","status":"PASS","evidence":"The [historical compressed index](https://www.cftc.gov/MarketReports/CommitmentsofTraders/HistoricalCompressed/index.htm) confirms distinct TFF Futures Only archives, while [special announcements](https://www.cftc.gov/MarketReports/CommitmentsofTraders/HistoricalSpecialAnnouncements/index.htm) show release interruptions and schedule exceptions can occur. These pages are change-control evidence only; no archive was downloaded and announcements cannot mutate sealed evidence."},{"name":"ONE_WAY_NETWORK_DENIED_BOUNDARY","status":"PASS","evidence":"Frozen repository governance supports a fixed producer, create-only hash-bound drop and independent network/database-denied canonical intake. No source writes canonical state, no caller-controlled request enters the producer and no timer or additional writer is introduced."},{"name":"PUBLIC_DOMAIN_AND_NO_SEAL","status":"PASS","evidence":"The [CFTC Web Policy](https://www.cftc.gov/WebPolicy/index.htm) states government website information is public domain with requested acknowledgement, excludes privately contributed/licensed material from that blanket rule and prohibits outside use of the CFTC seal. This audit is not legal advice."},{"name":"PERFORMANCE_AND_EXECUTION_PROOF","status":"MISSING_PROOF","evidence":"No report bytes, current row, capture, deployment or outcome were accessed. Predictive usefulness, chosen field, fees, slippage, utilization, false-veto cost, capacity, PnL and drawdown improvement remain unproved; immediate PnL and drawdown effect are zero."}],"artifacts":[],"files_changed":[],"uncertainty":["Actual point-in-time availability and existence of exactly one 133741 row were intentionally not inspected.","Future holiday schedules, extraordinary publication interruptions and documentation drift require versioned fail-closed updates.","Unix isolation, one-way permissions, canonical intake reliability, capacity and operational liveness are not deployed or proved.","No COT field, formula, normalization, threshold, direction, horizon or relationship to BTC returns was evaluated.","Public-domain handling is bounded by the official policy and is not legal advice."],"recommended_next_action":"Freeze one separate bounded WORKTREE_WRITE task limited to an offline source contract, closed schemas, strict validator and deterministic fixtures for CFTC_CME_BITCOIN_TFF_FUTURES_ONLY_V1. It must embed the fixed identity, ordered 87-field contract, versioned release calendar, ten-state machine and raw/row/hash-chain rules; it must not capture data, register or deploy a source, add a timer, select a factor or authorize OOS/Trading.","safety_assertions":{"canonical_state_changed":false,"server_research_mcp_write_attempted":false,"second_timer_created":false,"trading_action_attempted":false,"oos_opened":false,"paid_api_used":false}}
